row_id,title_match,reason
1,Америка открыла границы для УКРАИНЫ,Outdated/clickbait — likely 2022 era
2,РАЗРЕШЕНИЕ НА РАБОТУ В США 2022 | Форма i 765,2022 outdated — form versions changed
3,Украинцам отказывают в продлении пароля,Fearmongering without specific evidence
4,Статус под угрозой: 85% ЛЕГАЛЬНЫХ иммигрантов,Marketing clickbait
5,Что делать если отменят TPS и U4U?,Speculation about future actions
6,TPS/Re-parole програшний варіант,Speculation/opinion piece
7,Масово приходять запити на здачу біометричних даних,Panic post without verification
